"No.","Time","Source","Destination","Protocol","Length","Info"
"3","0.040180","204.79.197.203","192.168.1.14","TCP","54","443  >  63249 [RST, ACK] Seq=1 Ack=1 Win=0 Len=0"
"4","0.478342","2404:97c0:223:4181:d8ac:cbb4:17b:ef4b","2600:1901:1:566::","TLSv1.2","117","Application Data"
"5","0.490223","2600:1901:1:566::","2404:97c0:223:4181:d8ac:cbb4:17b:ef4b","TCP","74","443  >  62702 [ACK] Seq=1 Ack=44 Win=290 Len=0"
"6","0.795890","2600:1901:1:566::","2404:97c0:223:4181:d8ac:cbb4:17b:ef4b","TLSv1.2","114","Application Data"
"7","0.836808","2404:97c0:223:4181:d8ac:cbb4:17b:ef4b","2600:1901:1:566::","TCP","74","62702  >  443 [ACK] Seq=44 Ack=41 Win=513 Len=0"
"8","2.873519","192.168.1.14","192.168.1.12","TCP","164","62706  >  8009 [PSH, ACK] Seq=1 Ack=1 Win=509 Len=110 [TCP PDU reassembled in 181]"
"9","2.876362","192.168.1.12","192.168.1.14","TCP","164","8009  >  62706 [PSH, ACK] Seq=1 Ack=111 Win=1506 Len=110 [TCP PDU reassembled in 183]"
"10","2.921135","192.168.1.14","192.168.1.12","TCP","54","62706  >  8009 [ACK] Seq=111 Ack=111 Win=508 Len=0"
"11","4.280574","192.168.1.14","192.168.1.12","TCP","164","62671  >  8009 [PSH, ACK] Seq=1 Ack=1 Win=509 Len=110 [TCP PDU reassembled in 209]"
"12","4.283845","192.168.1.12","192.168.1.14","TCP","164","8009  >  62671 [PSH, ACK] Seq=1 Ack=111 Win=1506 Len=110 [TCP PDU reassembled in 210]"
"13","4.327183","192.168.1.14","192.168.1.12","TCP","54","62671  >  8009 [ACK] Seq=111 Ack=111 Win=509 Len=0"
"14","7.738914","192.168.1.14","192.168.1.12","TCP","55","62778  >  8008 [ACK] Seq=1 Ack=1 Win=508 Len=1"
"15","7.739046","192.168.1.14","192.168.1.12","TCP","55","62779  >  8008 [ACK] Seq=1 Ack=1 Win=508 Len=1"
"16","7.741308","192.168.1.12","192.168.1.14","TCP","66","8008  >  62778 [ACK] Seq=1 Ack=2 Win=1386 Len=0 SLE=1 SRE=2"
"17","7.741308","192.168.1.12","192.168.1.14","TCP","66","8008  >  62779 [ACK] Seq=1 Ack=2 Win=1386 Len=0 SLE=1 SRE=2"
"18","7.882255","192.168.1.14","192.168.1.12","TCP","164","62706  >  8009 [PSH, ACK] Seq=111 Ack=111 Win=508 Len=110 [TCP PDU reassembled in 181]"
"19","7.894295","192.168.1.12","192.168.1.14","TCP","164","8009  >  62706 [PSH, ACK] Seq=111 Ack=221 Win=1506 Len=110 [TCP PDU reassembled in 183]"
"20","7.945140","192.168.1.14","192.168.1.12","TCP","54","62706  >  8009 [ACK] Seq=221 Ack=221 Win=508 Len=0"
"21","9.287309","192.168.1.14","192.168.1.12","TCP","164","62671  >  8009 [PSH, ACK] Seq=111 Ack=111 Win=509 Len=110 [TCP PDU reassembled in 209]"
"22","9.293841","192.168.1.12","192.168.1.14","TCP","164","8009  >  62671 [PSH, ACK] Seq=111 Ack=221 Win=1506 Len=110 [TCP PDU reassembled in 210]"
"23","9.348809","192.168.1.14","192.168.1.12","TCP","54","62671  >  8009 [ACK] Seq=221 Ack=221 Win=508 Len=0"
"24","11.404947","2404:97c0:223:4181:d8ac:cbb4:17b:ef4b","2606:4700:4400::ac40:98aa","TCP","75","63217  >  443 [ACK] Seq=1 Ack=1 Win=515 Len=1"
"25","11.423432","2606:4700:4400::ac40:98aa","2404:97c0:223:4181:d8ac:cbb4:17b:ef4b","TCP","86","443  >  63217 [ACK] Seq=1 Ack=2 Win=8 Len=0 SLE=1 SRE=2"
"26","11.625366","192.168.1.14","52.139.252.32","TCP","55","62893  >  443 [ACK] Seq=1 Ack=1 Win=512 Len=1"
"27","11.656799","2404:97c0:223:4181:d8ac:cbb4:17b:ef4b","2606:4700:4400::6812:2356","TCP","75","63219  >  443 [ACK] Seq=1 Ack=1 Win=514 Len=1"
"28","11.672646","52.139.252.32","192.168.1.14","TCP","66","443  >  62893 [ACK] Seq=1 Ack=2 Win=63 Len=0 SLE=1 SRE=2"
"29","11.672646","2606:4700:4400::6812:2356","2404:97c0:223:4181:d8ac:cbb4:17b:ef4b","TCP","86","443  >  63219 [ACK] Seq=1 Ack=2 Win=8 Len=0 SLE=1 SRE=2"
"30","11.704692","192.168.1.14","35.186.224.44","TLSv1.2","82","Application Data"
"31","11.909083","2404:97c0:223:4181:d8ac:cbb4:17b:ef4b","2404:6800:4003:c02::84","TCP","75","63225  >  443 [ACK] Seq=1 Ack=1 Win=515 Len=1"
"32","11.940187","192.168.1.14","35.186.224.44","TCP","82","[TCP Retransmission] 62694  >  443 [PSH, ACK] Seq=1 Ack=1 Win=509 Len=28"
"33","11.951996","35.186.224.44","192.168.1.14","TCP","54","443  >  62694 [ACK] Seq=1 Ack=29 Win=272 Len=0"
"34","12.014988","2404:6800:4003:c02::84","2404:97c0:223:4181:d8ac:cbb4:17b:ef4b","TCP","86","443  >  63225 [ACK] Seq=1 Ack=2 Win=290 Len=0 SLE=1 SRE=2"
"35","12.018815","2404:97c0:223:4181:d8ac:cbb4:17b:ef4b","2404:6800:4003:c02::84","TCP","75","63253  >  443 [ACK] Seq=1 Ack=1 Win=511 Len=1"
"36","12.123862","2404:6800:4003:c02::84","2404:97c0:223:4181:d8ac:cbb4:17b:ef4b","TCP","86","443  >  63253 [ACK] Seq=1 Ack=2 Win=279 Len=0 SLE=1 SRE=2"
"37","12.254737","35.186.224.44","192.168.1.14","TLSv1.2","78","Application Data"
"38","12.302749","192.168.1.14","35.186.224.44","TCP","54","62694  >  443 [ACK] Seq=29 Ack=25 Win=508 Len=0"
"39","12.770993","192.168.1.14","40.126.35.87","TCP","66","63288  >  443 [SYN] Seq=0 Win=64240 Len=0 MSS=1460 WS=256 SACK_PERM"
"40","12.795274","40.126.35.87","192.168.1.14","TCP","66","443  >  63288 [SYN, ACK] Seq=0 Ack=1 Win=65535 Len=0 MSS=1440 WS=256 SACK_PERM"
"41","12.795432","192.168.1.14","40.126.35.87","TCP","54","63288  >  443 [ACK] Seq=1 Ack=1 Win=132352 Len=0"
"42","12.795927","192.168.1.14","40.126.35.87","TLSv1.2","283","Client Hello (SNI=login.live.com)"
"43","12.820712","40.126.35.87","192.168.1.14","TCP","2934","443  >  63288 [ACK] Seq=1 Ack=230 Win=4194304 Len=2880 [TCP PDU reassembled in 44]"
"44","12.820712","40.126.35.87","192.168.1.14","TLSv1.2","1133","Server Hello, Certificate, Certificate Status, Server Key Exchange, Server Hello Done"
"45","12.820834","192.168.1.14","40.126.35.87","TCP","54","63288  >  443 [ACK] Seq=230 Ack=3960 Win=132352 Len=0"
"46","12.844163","192.168.1.14","40.126.35.87","TLSv1.2","212","Client Key Exchange, Change Cipher Spec, Encrypted Handshake Message"
"47","12.869714","40.126.35.87","192.168.1.14","TLSv1.2","105","Change Cipher Spec, Encrypted Handshake Message"
"48","12.870729","192.168.1.14","40.126.35.87","TLSv1.2","333","Application Data"
"49","12.870846","192.168.1.14","40.126.35.87","TLSv1.2","4939","Application Data"
"50","12.895951","40.126.35.87","192.168.1.14","TCP","54","443  >  63288 [ACK] Seq=4011 Ack=2107 Win=4194560 Len=0"
"51","12.895951","40.126.35.87","192.168.1.14","TCP","54","443  >  63288 [ACK] Seq=4011 Ack=4987 Win=4194560 Len=0"
"52","12.900399","192.168.1.14","192.168.1.12","TCP","164","62706  >  8009 [PSH, ACK] Seq=221 Ack=221 Win=508 Len=110 [TCP PDU reassembled in 181]"
"53","12.907367","192.168.1.12","192.168.1.14","TCP","164","8009  >  62706 [PSH, ACK] Seq=221 Ack=331 Win=1506 Len=110 [TCP PDU reassembled in 183]"
"54","12.937464","40.126.35.87","192.168.1.14","TCP","54","443  >  63288 [ACK] Seq=4011 Ack=5552 Win=4194048 Len=0"
"55","12.947156","192.168.1.14","192.168.1.12","TCP","54","62706  >  8009 [ACK] Seq=331 Ack=331 Win=508 Len=0"
"56","13.113706","40.126.35.87","192.168.1.14","TCP","1494","443  >  63288 [ACK] Seq=4011 Ack=5552 Win=4194048 Len=1440 [TCP PDU reassembled in 60]"
"57","13.114000","40.126.35.87","192.168.1.14","TCP","2934","443  >  63288 [ACK] Seq=5451 Ack=5552 Win=4194048 Len=2880 [TCP PDU reassembled in 60]"
"58","13.114000","40.126.35.87","192.168.1.14","TCP","518","[TCP Previous segment not captured] 443  >  63288 [FIN, PSH, ACK] Seq=9771 Ack=5552 Win=4194048 Len=464 [TCP PDU reassembled in 60]"
"59","13.114086","192.168.1.14","40.126.35.87","TCP","66","63288  >  443 [ACK] Seq=5552 Ack=8331 Win=132352 Len=0 SLE=9771 SRE=10235"
"60","13.114202","40.126.35.87","192.168.1.14","TCP","1494","[TCP Out-Of-Order] 443  >  63288 [ACK] Seq=8331 Ack=5552 Win=4194048 Len=1440"
"61","13.114228","192.168.1.14","40.126.35.87","TCP","54","63288  >  443 [ACK] Seq=5552 Ack=10236 Win=132352 Len=0"
"62","13.114812","192.168.1.14","40.126.35.87","TLSv1.2","85","Encrypted Alert"
"63","13.114885","192.168.1.14","40.126.35.87","TCP","54","63288  >  443 [FIN, ACK] Seq=5583 Ack=10236 Win=132352 Len=0"
"64","13.138515","40.126.35.87","192.168.1.14","TCP","54","443  >  63288 [ACK] Seq=10236 Ack=5584 Win=4194048 Len=0"
"65","14.302815","192.168.1.14","192.168.1.12","TCP","164","62671  >  8009 [PSH, ACK] Seq=221 Ack=221 Win=508 Len=110 [TCP PDU reassembled in 209]"
"66","14.306179","192.168.1.12","192.168.1.14","TCP","164","8009  >  62671 [PSH, ACK] Seq=221 Ack=331 Win=1506 Len=110 [TCP PDU reassembled in 210]"
"67","14.348208","192.168.1.14","192.168.1.12","TCP","54","62671  >  8009 [ACK] Seq=331 Ack=331 Win=508 Len=0"
"74","17.917537","192.168.1.14","192.168.1.12","TCP","164","62706  >  8009 [PSH, ACK] Seq=331 Ack=331 Win=508 Len=110 [TCP PDU reassembled in 181]"
"75","17.924004","192.168.1.12","192.168.1.14","TCP","164","8009  >  62706 [PSH, ACK] Seq=331 Ack=441 Win=1506 Len=110 [TCP PDU reassembled in 183]"
"76","17.979190","192.168.1.14","192.168.1.12","TCP","54","62706  >  8009 [ACK] Seq=441 Ack=441 Win=507 Len=0"
"77","19.322710","192.168.1.14","192.168.1.12","TCP","164","62671  >  8009 [PSH, ACK] Seq=331 Ack=331 Win=508 Len=110 [TCP PDU reassembled in 209]"
"78","19.326550","192.168.1.12","192.168.1.14","TCP","164","8009  >  62671 [PSH, ACK] Seq=331 Ack=441 Win=1506 Len=110 [TCP PDU reassembled in 210]"
"79","19.369438","192.168.1.14","192.168.1.12","TCP","54","62671  >  8009 [ACK] Seq=441 Ack=441 Win=508 Len=0"
"80","22.927600","192.168.1.14","192.168.1.12","TCP","164","62706  >  8009 [PSH, ACK] Seq=441 Ack=441 Win=507 Len=110 [TCP PDU reassembled in 181]"
"81","22.931003","192.168.1.12","192.168.1.14","TCP","164","8009  >  62706 [PSH, ACK] Seq=441 Ack=551 Win=1506 Len=110 [TCP PDU reassembled in 183]"
"82","22.974279","192.168.1.14","192.168.1.12","TCP","54","62706  >  8009 [ACK] Seq=551 Ack=551 Win=513 Len=0"
"83","23.195047","2404:97c0:223:4181:d8ac:cbb4:17b:ef4b","2600:1901:1:7c5::","TCP","75","62993  >  443 [ACK] Seq=1 Ack=1 Win=512 Len=1"
"84","23.206761","2600:1901:1:7c5::","2404:97c0:223:4181:d8ac:cbb4:17b:ef4b","TCP","86","443  >  62993 [ACK] Seq=1 Ack=2 Win=279 Len=0 SLE=1 SRE=2"
"85","23.352047","2404:97c0:223:4181:d8ac:cbb4:17b:ef4b","2600:1901:1:4be::","TCP","75","63072  >  443 [ACK] Seq=1 Ack=1 Win=512 Len=1"
"86","23.363771","2600:1901:1:4be::","2404:97c0:223:4181:d8ac:cbb4:17b:ef4b","TCP","86","443  >  63072 [ACK] Seq=1 Ack=2 Win=279 Len=0 SLE=1 SRE=2"
"87","24.334953","192.168.1.14","192.168.1.12","TCP","164","62671  >  8009 [PSH, ACK] Seq=441 Ack=441 Win=508 Len=110 [TCP PDU reassembled in 209]"
"88","24.337715","192.168.1.12","192.168.1.14","TCP","164","8009  >  62671 [PSH, ACK] Seq=441 Ack=551 Win=1506 Len=110 [TCP PDU reassembled in 210]"
"89","24.381538","192.168.1.14","192.168.1.12","TCP","54","62671  >  8009 [ACK] Seq=551 Ack=551 Win=507 Len=0"
"91","26.022843","2620:1ec:46::254","2404:97c0:223:4181:d8ac:cbb4:17b:ef4b","TLSv1.2","98","Application Data"
"92","26.023067","2404:97c0:223:4181:d8ac:cbb4:17b:ef4b","2620:1ec:46::254","TCP","74","63282  >  443 [ACK] Seq=1 Ack=25 Win=1024 Len=0"
"93","26.023184","2620:1ec:46::254","2404:97c0:223:4181:d8ac:cbb4:17b:ef4b","TCP","74","443  >  63282 [FIN, ACK] Seq=25 Ack=1 Win=84 Len=0"
"94","26.023222","2404:97c0:223:4181:d8ac:cbb4:17b:ef4b","2620:1ec:46::254","TCP","74","63282  >  443 [ACK] Seq=1 Ack=26 Win=1024 Len=0"
"96","27.939057","192.168.1.14","192.168.1.12","TCP","164","62706  >  8009 [PSH, ACK] Seq=551 Ack=551 Win=513 Len=110 [TCP PDU reassembled in 181]"
"97","27.942136","192.168.1.12","192.168.1.14","TCP","164","8009  >  62706 [PSH, ACK] Seq=551 Ack=661 Win=1506 Len=110 [TCP PDU reassembled in 183]"
"98","27.985220","192.168.1.14","192.168.1.12","TCP","54","62706  >  8009 [ACK] Seq=661 Ack=661 Win=512 Len=0"
"99","28.110277","192.168.1.14","3.165.102.101","TCP","55","62870  >  443 [ACK] Seq=1 Ack=1 Win=512 Len=1"
"100","28.135091","3.165.102.101","192.168.1.14","TCP","66","443  >  62870 [ACK] Seq=1 Ack=2 Win=151 Len=0 SLE=1 SRE=2"
"101","29.345612","192.168.1.14","192.168.1.12","TCP","164","62671  >  8009 [PSH, ACK] Seq=551 Ack=551 Win=507 Len=110 [TCP PDU reassembled in 209]"
"102","29.349174","192.168.1.12","192.168.1.14","TCP","164","8009  >  62671 [PSH, ACK] Seq=551 Ack=661 Win=1506 Len=110 [TCP PDU reassembled in 210]"
"103","29.391570","192.168.1.14","192.168.1.12","TCP","54","62671  >  8009 [ACK] Seq=661 Ack=661 Win=513 Len=0"
"104","30.799261","2404:97c0:223:4181:d8ac:cbb4:17b:ef4b","2600:1901:1:566::","TLSv1.2","117","Application Data"
"105","30.811109","2600:1901:1:566::","2404:97c0:223:4181:d8ac:cbb4:17b:ef4b","TCP","74","443  >  62702 [ACK] Seq=41 Ack=87 Win=290 Len=0"
"108","31.112829","2600:1901:1:566::","2404:97c0:223:4181:d8ac:cbb4:17b:ef4b","TLSv1.2","114","Application Data"
"109","31.158736","2404:97c0:223:4181:d8ac:cbb4:17b:ef4b","2600:1901:1:566::","TCP","74","62702  >  443 [ACK] Seq=87 Ack=81 Win=513 Len=0"
"110","32.945142","192.168.1.14","192.168.1.12","TCP","164","62706  >  8009 [PSH, ACK] Seq=661 Ack=661 Win=512 Len=110 [TCP PDU reassembled in 181]"
"111","32.953539","192.168.1.12","192.168.1.14","TCP","164","8009  >  62706 [PSH, ACK] Seq=661 Ack=771 Win=1506 Len=110 [TCP PDU reassembled in 183]"
"112","33.007252","192.168.1.14","192.168.1.12","TCP","54","62706  >  8009 [ACK] Seq=771 Ack=771 Win=512 Len=0"
"136","34.357498","192.168.1.14","192.168.1.12","TCP","164","62671  >  8009 [PSH, ACK] Seq=661 Ack=661 Win=513 Len=110 [TCP PDU reassembled in 209]"
"137","34.360229","192.168.1.12","192.168.1.14","TCP","164","8009  >  62671 [PSH, ACK] Seq=661 Ack=771 Win=1506 Len=110 [TCP PDU reassembled in 210]"
"138","34.403671","192.168.1.14","192.168.1.12","TCP","54","62671  >  8009 [ACK] Seq=771 Ack=771 Win=512 Len=0"
"139","35.880547","192.168.1.14","52.182.141.63","TCP","66","63289  >  443 [SYN] Seq=0 Win=65535 Len=0 MSS=1460 WS=256 SACK_PERM"
"140","36.110528","52.182.141.63","192.168.1.14","TCP","66","443  >  63289 [SYN, ACK] Seq=0 Ack=1 Win=65535 Len=0 MSS=1440 WS=256 SACK_PERM"
"141","36.110661","192.168.1.14","52.182.141.63","TCP","54","63289  >  443 [ACK] Seq=1 Ack=1 Win=262144 Len=0"
"142","36.113827","192.168.1.14","52.182.141.63","TLSv1.3","445","Client Hello (SNI=self.events.data.microsoft.com)"
"143","36.344337","52.182.141.63","192.168.1.14","TLSv1.3","153","Hello Retry Request, Change Cipher Spec"
"144","36.344474","192.168.1.14","52.182.141.63","TCP","54","63289  >  443 [ACK] Seq=392 Ack=100 Win=261888 Len=0"
"145","36.355746","192.168.1.14","52.182.141.63","TLSv1.3","516","Change Cipher Spec, Client Hello (SNI=self.events.data.microsoft.com)"
"148","36.586475","52.182.141.63","192.168.1.14","TLSv1.3","1494","Server Hello"
"149","36.586593","192.168.1.14","52.182.141.63","TCP","54","63289  >  443 [ACK] Seq=854 Ack=1540 Win=262144 Len=0"
"150","36.587058","52.182.141.63","192.168.1.14","TCP","4374","443  >  63289 [ACK] Seq=1540 Ack=854 Win=4193792 Len=4320 [TCP PDU reassembled in 151]"
"151","36.587058","52.182.141.63","192.168.1.14","TLSv1.3","680","Application Data"
"152","36.587130","192.168.1.14","52.182.141.63","TCP","54","63289  >  443 [ACK] Seq=854 Ack=6486 Win=262144 Len=0"
"153","36.590420","192.168.1.14","52.182.141.63","TLSv1.3","128","Application Data"
"154","36.590738","192.168.1.14","52.182.141.63","TLSv1.3","505","Application Data"
"155","36.590796","192.168.1.14","52.182.141.63","TLSv1.3","5225","Application Data"
"158","36.819625","52.182.141.63","192.168.1.14","TCP","54","443  >  63289 [ACK] Seq=6486 Ack=1379 Win=4193280 Len=0"
"159","36.819625","52.182.141.63","192.168.1.14","TLSv1.3","157","Application Data"
"160","36.819733","192.168.1.14","52.182.141.63","TCP","54","63289  >  443 [ACK] Seq=6550 Ack=6589 Win=261888 Len=0"
"161","36.819915","52.182.141.63","192.168.1.14","TLSv1.3","101","Application Data"
"162","36.819936","192.168.1.14","52.182.141.63","TCP","54","63289  >  443 [ACK] Seq=6550 Ack=6636 Win=261888 Len=0"
"163","36.820452","52.182.141.63","192.168.1.14","TCP","54","443  >  63289 [ACK] Seq=6636 Ack=2819 Win=4194560 Len=0"
"164","36.820452","52.182.141.63","192.168.1.14","TCP","54","443  >  63289 [ACK] Seq=6636 Ack=4259 Win=4194560 Len=0"
"165","36.821519","52.182.141.63","192.168.1.14","TCP","54","443  >  63289 [ACK] Seq=6636 Ack=5699 Win=4194560 Len=0"
"166","36.821519","52.182.141.63","192.168.1.14","TCP","54","443  >  63289 [ACK] Seq=6636 Ack=6550 Win=4193792 Len=0"
"167","36.825459","52.182.141.63","192.168.1.14","TLSv1.3","502","Application Data"
"168","36.825558","192.168.1.14","52.182.141.63","TCP","54","63289  >  443 [ACK] Seq=6550 Ack=7084 Win=261376 Len=0"
"169","36.827519","192.168.1.14","52.182.141.63","TLSv1.3","505","Application Data"
"170","36.827627","192.168.1.14","52.182.141.63","TLSv1.3","4539","Application Data"
"171","37.056549","52.182.141.63","192.168.1.14","TCP","54","443  >  63289 [ACK] Seq=7084 Ack=8441 Win=4194560 Len=0"
"172","37.056549","52.182.141.63","192.168.1.14","TLSv1.3","101","Application Data"
"173","37.056718","192.168.1.14","52.182.141.63","TCP","54","63289  >  443 [ACK] Seq=11486 Ack=7131 Win=261376 Len=0"
"174","37.057462","52.182.141.63","192.168.1.14","TCP","54","443  >  63289 [ACK] Seq=7131 Ack=11321 Win=4194560 Len=0"
"175","37.060602","52.182.141.63","192.168.1.14","TLSv1.3","502","Application Data"
"176","37.060747","192.168.1.14","52.182.141.63","TCP","54","63289  >  443 [ACK] Seq=11486 Ack=7579 Win=260864 Len=0"
"181","37.963546","192.168.1.14","192.168.1.12","AJP13","164","AJP13 Error?"
"182","37.978169","2404:97c0:223:4181:d8ac:cbb4:17b:ef4b","2404:6800:4003:c11::61","TCP","75","63218  >  443 [ACK] Seq=1 Ack=1 Win=510 Len=1"
"183","37.987385","192.168.1.12","192.168.1.14","AJP13","168","AJP13 Error?"
"184","37.987958","192.168.1.14","192.168.1.12","TCP","164","62706  >  8009 [PSH, ACK] Seq=881 Ack=885 Win=511 Len=110"
"185","37.991023","192.168.1.12","192.168.1.14","TCP","54","8009  >  62706 [ACK] Seq=885 Ack=991 Win=1506 Len=0"
"186","37.991023","192.168.1.12","192.168.1.14","TCP","164","8009  >  62706 [PSH, ACK] Seq=885 Ack=991 Win=1506 Len=110"
"187","38.041500","192.168.1.14","192.168.1.12","TCP","54","62706  >  8009 [ACK] Seq=991 Ack=995 Win=511 Len=0"
"188","38.082528","2404:6800:4003:c11::61","2404:97c0:223:4181:d8ac:cbb4:17b:ef4b","TCP","86","443  >  63218 [ACK] Seq=1 Ack=2 Win=290 Len=0 SLE=1 SRE=2"
"191","38.323675","2404:97c0:223:4181:d8ac:cbb4:17b:ef4b","2001:4860:4802:38::178","TCP","75","63222  >  443 [ACK] Seq=1 Ack=1 Win=515 Len=1"
"192","38.428559","2001:4860:4802:38::178","2404:97c0:223:4181:d8ac:cbb4:17b:ef4b","TCP","86","443  >  63222 [ACK] Seq=1 Ack=2 Win=279 Len=0 SLE=1 SRE=2"
"193","38.544270","2404:97c0:223:4181:d8ac:cbb4:17b:ef4b","2404:6800:4003:c00::9c","TCP","75","63223  >  443 [ACK] Seq=1 Ack=1 Win=511 Len=1"
"198","38.648906","2404:6800:4003:c00::9c","2404:97c0:223:4181:d8ac:cbb4:17b:ef4b","TCP","86","443  >  63223 [ACK] Seq=1 Ack=2 Win=1045 Len=0 SLE=1 SRE=2"
"199","38.701219","2404:97c0:223:4181:d8ac:cbb4:17b:ef4b","2406:2600:7:100::9","TCP","75","63228  >  443 [ACK] Seq=1 Ack=1 Win=513 Len=1"
"200","38.724654","2406:2600:7:100::9","2404:97c0:223:4181:d8ac:cbb4:17b:ef4b","TCP","86","443  >  63228 [ACK] Seq=1 Ack=2 Win=63 Len=0 SLE=1 SRE=2"
"201","38.732262","192.168.1.14","182.161.73.136","TCP","55","63232  >  443 [ACK] Seq=1 Ack=1 Win=517 Len=1"
"202","38.755761","182.161.73.136","192.168.1.14","TCP","66","443  >  63232 [ACK] Seq=1 Ack=2 Win=63 Len=0 SLE=1 SRE=2"
"203","38.857222","192.168.1.14","182.161.73.136","TCP","55","63233  >  443 [ACK] Seq=1 Ack=1 Win=517 Len=1"
"204","38.880470","182.161.73.136","192.168.1.14","TCP","66","443  >  63233 [ACK] Seq=1 Ack=2 Win=63 Len=0 SLE=1 SRE=2"
"205","38.967816","2404:97c0:223:4181:d8ac:cbb4:17b:ef4b","2404:6800:4003:c00::9c","TCP","75","63220  >  443 [ACK] Seq=1 Ack=1 Win=511 Len=1"
"206","39.015845","2404:97c0:223:4181:d8ac:cbb4:17b:ef4b","2404:6800:4003:c1a::9a","TCP","75","63231  >  443 [ACK] Seq=1 Ack=1 Win=512 Len=1"
"207","39.071569","2404:6800:4003:c00::9c","2404:97c0:223:4181:d8ac:cbb4:17b:ef4b","TCP","86","443  >  63220 [ACK] Seq=1 Ack=2 Win=279 Len=0 SLE=1 SRE=2"
"208","39.120469","2404:6800:4003:c1a::9a","2404:97c0:223:4181:d8ac:cbb4:17b:ef4b","TCP","86","443  >  63231 [ACK] Seq=1 Ack=2 Win=279 Len=0 SLE=1 SRE=2"
"209","39.373580","192.168.1.14","192.168.1.12","AJP13","164","AJP13 Error?"
"210","39.376157","192.168.1.12","192.168.1.14","AJP13","164","AJP13 Error?"
"211","39.388789","2404:97c0:223:4181:d8ac:cbb4:17b:ef4b","2404:6800:4003:c1c::84","TCP","75","63234  >  443 [ACK] Seq=1 Ack=1 Win=512 Len=1"
"212","39.420046","192.168.1.14","192.168.1.12","TCP","54","62671  >  8009 [ACK] Seq=881 Ack=881 Win=512 Len=0"
"213","39.492486","2404:6800:4003:c1c::84","2404:97c0:223:4181:d8ac:cbb4:17b:ef4b","TCP","86","443  >  63234 [ACK] Seq=1 Ack=2 Win=279 Len=0 SLE=1 SRE=2"
"218","40.206973","2404:97c0:223:4181:d8ac:cbb4:17b:ef4b","2404:6800:4003:c1a::9a","TCP","75","63236  >  443 [ACK] Seq=1 Ack=1 Win=512 Len=1"
"219","40.310371","2404:6800:4003:c1a::9a","2404:97c0:223:4181:d8ac:cbb4:17b:ef4b","TCP","86","443  >  63236 [ACK] Seq=1 Ack=2 Win=279 Len=0 SLE=1 SRE=2"
"220","40.539281","2404:97c0:223:4181:d8ac:cbb4:17b:ef4b","2404:6800:4003:c1a::9a","TCP","75","63237  >  443 [ACK] Seq=1 Ack=1 Win=512 Len=1"
"221","40.643949","2404:6800:4003:c1a::9a","2404:97c0:223:4181:d8ac:cbb4:17b:ef4b","TCP","86","443  >  63237 [ACK] Seq=1 Ack=2 Win=279 Len=0 SLE=1 SRE=2"
"224","42.690852","192.168.1.14","35.186.224.44","TLSv1.2","82","Application Data"
"225","42.701849","35.186.224.44","192.168.1.14","TCP","54","443  >  62694 [ACK] Seq=25 Ack=57 Win=272 Len=0"
"226","43.005013","192.168.1.14","192.168.1.12","TCP","164","62706  >  8009 [PSH, ACK] Seq=991 Ack=995 Win=511 Len=110"
"227","43.005139","35.186.224.44","192.168.1.14","TLSv1.2","78","Application Data"
"228","43.011676","192.168.1.12","192.168.1.14","TCP","164","8009  >  62706 [PSH, ACK] Seq=995 Ack=1101 Win=1506 Len=110"
"229","43.051461","192.168.1.14","35.186.224.44","TCP","54","62694  >  443 [ACK] Seq=57 Ack=49 Win=508 Len=0"
"230","43.051724","192.168.1.14","192.168.1.12","TCP","54","62706  >  8009 [ACK] Seq=1101 Ack=1105 Win=511 Len=0"
"242","44.385358","192.168.1.14","192.168.1.12","TCP","164","62671  >  8009 [PSH, ACK] Seq=881 Ack=881 Win=512 Len=110"
"243","44.414325","192.168.1.12","192.168.1.14","TCP","164","8009  >  62671 [PSH, ACK] Seq=881 Ack=991 Win=1506 Len=110"
"244","44.463023","192.168.1.14","192.168.1.12","TCP","54","62671  >  8009 [ACK] Seq=991 Ack=991 Win=511 Len=0"
"252","48.016469","192.168.1.14","192.168.1.12","TCP","164","62706  >  8009 [PSH, ACK] Seq=1101 Ack=1105 Win=511 Len=110"
"253","48.018905","192.168.1.12","192.168.1.14","TCP","164","8009  >  62706 [PSH, ACK] Seq=1105 Ack=1211 Win=1506 Len=110"
"254","48.062300","192.168.1.14","192.168.1.12","TCP","54","62706  >  8009 [ACK] Seq=1211 Ack=1215 Win=510 Len=0"
"255","49.424321","192.168.1.14","192.168.1.12","TCP","164","62671  >  8009 [PSH, ACK] Seq=991 Ack=991 Win=511 Len=110"
"256","49.431080","192.168.1.12","192.168.1.14","TCP","164","8009  >  62671 [PSH, ACK] Seq=991 Ack=1101 Win=1506 Len=110"
"257","49.485992","192.168.1.14","192.168.1.12","TCP","54","62671  >  8009 [ACK] Seq=1101 Ack=1101 Win=511 Len=0"
"258","50.612881","192.168.1.14","40.126.35.87","TCP","66","63290  >  443 [SYN] Seq=0 Win=64240 Len=0 MSS=1460 WS=256 SACK_PERM"
"259","50.637141","40.126.35.87","192.168.1.14","TCP","66","443  >  63290 [SYN, ACK] Seq=0 Ack=1 Win=65535 Len=0 MSS=1440 WS=256 SACK_PERM"
"260","50.637457","192.168.1.14","40.126.35.87","TCP","54","63290  >  443 [ACK] Seq=1 Ack=1 Win=132352 Len=0"
"261","50.638276","192.168.1.14","40.126.35.87","TLSv1.2","283","Client Hello (SNI=login.live.com)"
"262","50.662128","40.126.35.87","192.168.1.14","TCP","1494","443  >  63290 [ACK] Seq=1 Ack=230 Win=4194304 Len=1440 [TCP PDU reassembled in 264]"
"263","50.662452","40.126.35.87","192.168.1.14","TCP","1133","[TCP Previous segment not captured] 443  >  63290 [PSH, ACK] Seq=2881 Ack=230 Win=4194304 Len=1079 [TCP PDU reassembled in 264]"
"264","50.662452","40.126.35.87","192.168.1.14","TCP","1494","[TCP Out-Of-Order] 443  >  63290 [ACK] Seq=1441 Ack=230 Win=4194304 Len=1440"
"265","50.662502","192.168.1.14","40.126.35.87","TCP","66","63290  >  443 [ACK] Seq=230 Ack=1441 Win=132352 Len=0 SLE=2881 SRE=3960"
"266","50.662589","192.168.1.14","40.126.35.87","TCP","54","63290  >  443 [ACK] Seq=230 Ack=3960 Win=132352 Len=0"
"267","50.678830","192.168.1.14","40.126.35.87","TLSv1.2","212","Client Key Exchange, Change Cipher Spec, Encrypted Handshake Message"
"268","50.702870","40.126.35.87","192.168.1.14","TLSv1.2","105","Change Cipher Spec, Encrypted Handshake Message"
"269","50.704174","192.168.1.14","40.126.35.87","TLSv1.2","333","Application Data"
"270","50.704297","192.168.1.14","40.126.35.87","TLSv1.2","6716","Application Data"
"271","50.728032","40.126.35.87","192.168.1.14","TCP","54","443  >  63290 [ACK] Seq=4011 Ack=2107 Win=4194560 Len=0"
"272","50.729669","40.126.35.87","192.168.1.14","TCP","54","443  >  63290 [ACK] Seq=4011 Ack=4987 Win=4194560 Len=0"
"273","50.730161","40.126.35.87","192.168.1.14","TCP","54","443  >  63290 [ACK] Seq=4011 Ack=7329 Win=4194560 Len=0"
"274","50.934114","40.126.35.87","192.168.1.14","TCP","1494","443  >  63290 [ACK] Seq=4011 Ack=7329 Win=4194560 Len=1440 [TCP PDU reassembled in 281]"
"275","50.939239","40.126.35.87","192.168.1.14","TCP","4374","443  >  63290 [ACK] Seq=5451 Ack=7329 Win=4194560 Len=4320 [TCP PDU reassembled in 281]"
"276","50.939239","40.126.35.87","192.168.1.14","TCP","2934","[TCP Previous segment not captured] 443  >  63290 [ACK] Seq=12651 Ack=7329 Win=4194560 Len=2880 [TCP PDU reassembled in 281]"
"277","50.939239","40.126.35.87","192.168.1.14","TCP","1494","[TCP Previous segment not captured] 443  >  63290 [ACK] Seq=16971 Ack=7329 Win=4194560 Len=1440 [TCP PDU reassembled in 281]"
"278","50.939239","40.126.35.87","192.168.1.14","TCP","2934","[TCP Out-Of-Order] 443  >  63290 [ACK] Seq=9771 Ack=7329 Win=4194560 Len=2880 [TCP PDU reassembled in 281]"
"279","50.939239","40.126.35.87","192.168.1.14","TCP","1494","[TCP Out-Of-Order] 443  >  63290 [ACK] Seq=15531 Ack=7329 Win=4194560 Len=1440 [TCP PDU reassembled in 281]"
"280","50.939239","40.126.35.87","192.168.1.14","TCP","1494","443  >  63290 [ACK] Seq=18411 Ack=7329 Win=4194560 Len=1440 [TCP PDU reassembled in 281]"
"281","50.939239","40.126.35.87","192.168.1.14","TLSv1.2","553","Application Data"
"282","50.939451","192.168.1.14","40.126.35.87","TCP","66","63290  >  443 [ACK] Seq=7329 Ack=9771 Win=132352 Len=0 SLE=12651 SRE=15531"
"283","50.939551","192.168.1.14","40.126.35.87","TCP","74","[TCP Dup ACK 282#1] 63290  >  443 [ACK] Seq=7329 Ack=9771 Win=132352 Len=0 SLE=16971 SRE=18411 SLE=12651 SRE=15531"
"284","50.939594","192.168.1.14","40.126.35.87","TCP","66","63290  >  443 [ACK] Seq=7329 Ack=15531 Win=132352 Len=0 SLE=16971 SRE=18411"
"285","50.939621","192.168.1.14","40.126.35.87","TCP","54","63290  >  443 [ACK] Seq=7329 Ack=18411 Win=132352 Len=0"
"286","50.939659","192.168.1.14","40.126.35.87","TCP","54","63290  >  443 [ACK] Seq=7329 Ack=20351 Win=132352 Len=0"
"287","50.940903","192.168.1.14","40.126.35.87","TLSv1.2","85","Encrypted Alert"
"288","50.941026","192.168.1.14","40.126.35.87","TCP","54","63290  >  443 [FIN, ACK] Seq=7360 Ack=20351 Win=132352 Len=0"
"289","50.964649","40.126.35.87","192.168.1.14","TCP","54","443  >  63290 [ACK] Seq=20351 Ack=7361 Win=4194560 Len=0"
"290","52.750575","192.168.1.14","192.168.1.12","TCP","55","[TCP Keep-Alive] 62778  >  8008 [ACK] Seq=1 Ack=1 Win=508 Len=1"
"291","52.750728","192.168.1.14","192.168.1.12","TCP","55","[TCP Keep-Alive] 62779  >  8008 [ACK] Seq=1 Ack=1 Win=508 Len=1"
"292","52.756171","192.168.1.12","192.168.1.14","TCP","66","[TCP Keep-Alive ACK] 8008  >  62778 [ACK] Seq=1 Ack=2 Win=1386 Len=0 SLE=1 SRE=2"
"293","52.756171","192.168.1.12","192.168.1.14","TCP","66","[TCP Keep-Alive ACK] 8008  >  62779 [ACK] Seq=1 Ack=2 Win=1386 Len=0 SLE=1 SRE=2"
"294","53.025376","34.158.1.133","192.168.1.14","TCP","65","4070  >  62668 [PSH, ACK] Seq=1 Ack=1 Win=6 Len=11"
"295","53.034723","192.168.1.14","192.168.1.12","TCP","164","62706  >  8009 [PSH, ACK] Seq=1211 Ack=1215 Win=510 Len=110"
"296","53.062691","192.168.1.12","192.168.1.14","TCP","164","8009  >  62706 [PSH, ACK] Seq=1215 Ack=1321 Win=1506 Len=110"
"297","53.065443","192.168.1.14","34.158.1.133","TCP","54","62668  >  4070 [ACK] Seq=1 Ack=12 Win=513 Len=0"
"298","53.112797","192.168.1.14","192.168.1.12","TCP","54","62706  >  8009 [ACK] Seq=1321 Ack=1325 Win=510 Len=0"
"311","54.447303","192.168.1.14","192.168.1.12","TCP","164","62671  >  8009 [PSH, ACK] Seq=1101 Ack=1101 Win=511 Len=110"
"312","54.455684","192.168.1.12","192.168.1.14","TCP","164","8009  >  62671 [PSH, ACK] Seq=1101 Ack=1211 Win=1506 Len=110"
"313","54.509706","192.168.1.14","192.168.1.12","TCP","54","62671  >  8009 [ACK] Seq=1211 Ack=1211 Win=511 Len=0"
"315","54.984605","52.168.117.171","192.168.1.14","TCP","54","443  >  63269 [RST, ACK] Seq=1 Ack=1 Win=0 Len=0"
"330","56.436218","2404:97c0:223:4181:d8ac:cbb4:17b:ef4b","2606:4700:4400::ac40:98aa","TCP","75","[TCP Keep-Alive] 63217  >  443 [ACK] Seq=1 Ack=1 Win=515 Len=1"
"331","56.449015","2606:4700:4400::ac40:98aa","2404:97c0:223:4181:d8ac:cbb4:17b:ef4b","TCP","86","[TCP Keep-Alive ACK] 443  >  63217 [ACK] Seq=1 Ack=2 Win=8 Len=0 SLE=1 SRE=2"
"332","56.488295","52.139.252.32","192.168.1.14","TLSv1.2","93","Application Data"
"333","56.488295","52.139.252.32","192.168.1.14","TLSv1.2","78","Application Data"
"334","56.488475","192.168.1.14","52.139.252.32","TCP","54","62893  >  443 [ACK] Seq=2 Ack=65 Win=512 Len=0"
"335","56.488802","192.168.1.14","52.139.252.32","TCP","54","62893  >  443 [FIN, ACK] Seq=2 Ack=65 Win=512 Len=0"
"336","56.519023","52.139.252.32","192.168.1.14","TCP","54","443  >  62893 [ACK] Seq=65 Ack=3 Win=63 Len=0"
"337","56.672953","2404:97c0:223:4181:d8ac:cbb4:17b:ef4b","2606:4700:4400::6812:2356","TCP","75","[TCP Keep-Alive] 63219  >  443 [ACK] Seq=1 Ack=1 Win=514 Len=1"
"338","56.684127","2606:4700:4400::6812:2356","2404:97c0:223:4181:d8ac:cbb4:17b:ef4b","TCP","86","[TCP Keep-Alive ACK] 443  >  63219 [ACK] Seq=1 Ack=2 Win=8 Len=0 SLE=1 SRE=2"
"349","56.798717","2404:97c0:223:4181:d8ac:cbb4:17b:ef4b","2600:1901:1:7c5::","TCP","74","62993  >  443 [FIN, ACK] Seq=2 Ack=1 Win=512 Len=0"
"350","56.799572","2404:97c0:223:4181:d8ac:cbb4:17b:ef4b","2600:1901:1:7c5::","TCP","86","63291  >  443 [SYN] Seq=0 Win=64800 Len=0 MSS=1440 WS=256 SACK_PERM"
"359","56.809781","2600:1901:1:7c5::","2404:97c0:223:4181:d8ac:cbb4:17b:ef4b","TCP","74","443  >  62993 [FIN, ACK] Seq=1 Ack=3 Win=279 Len=0"
"360","56.809858","2404:97c0:223:4181:d8ac:cbb4:17b:ef4b","2600:1901:1:7c5::","TCP","74","62993  >  443 [ACK] Seq=3 Ack=2 Win=512 Len=0"
"361","56.811480","2600:1901:1:7c5::","2404:97c0:223:4181:d8ac:cbb4:17b:ef4b","TCP","86","443  >  63291 [SYN, ACK] Seq=0 Ack=1 Win=65535 Len=0 MSS=1420 SACK_PERM WS=256"
"362","56.811637","2404:97c0:223:4181:d8ac:cbb4:17b:ef4b","2600:1901:1:7c5::","TCP","74","63291  >  443 [ACK] Seq=1 Ack=1 Win=131840 Len=0"
"363","56.812951","2404:97c0:223:4181:d8ac:cbb4:17b:ef4b","2600:1901:1:7c5::","TLSv1.3","2179","Client Hello (SNI=spclient.wg.spotify.com)"
"369","56.825442","2600:1901:1:7c5::","2404:97c0:223:4181:d8ac:cbb4:17b:ef4b","TCP","74","443  >  63291 [ACK] Seq=1 Ack=1421 Win=68608 Len=0"
"370","56.825442","2600:1901:1:7c5::","2404:97c0:223:4181:d8ac:cbb4:17b:ef4b","TCP","74","443  >  63291 [ACK] Seq=1 Ack=2106 Win=71424 Len=0"
"371","56.840957","2600:1901:1:7c5::","2404:97c0:223:4181:d8ac:cbb4:17b:ef4b","TLSv1.3","286","Server Hello, Change Cipher Spec, Application Data"
"372","56.841725","2404:97c0:223:4181:d8ac:cbb4:17b:ef4b","2600:1901:1:7c5::","TLSv1.3","138","Change Cipher Spec, Application Data"
"374","56.854739","2600:1901:1:7c5::","2404:97c0:223:4181:d8ac:cbb4:17b:ef4b","TLSv1.3","660","Application Data, Application Data"
"378","56.907627","2404:97c0:223:4181:d8ac:cbb4:17b:ef4b","2600:1901:1:7c5::","TCP","74","63291  >  443 [ACK] Seq=2170 Ack=799 Win=131072 Len=0"
"380","57.017342","2404:97c0:223:4181:d8ac:cbb4:17b:ef4b","2404:6800:4003:c02::84","TCP","75","[TCP Keep-Alive] 63225  >  443 [ACK] Seq=1 Ack=1 Win=515 Len=1"
"381","57.122212","2404:6800:4003:c02::84","2404:97c0:223:4181:d8ac:cbb4:17b:ef4b","TCP","86","[TCP Keep-Alive ACK] 443  >  63225 [ACK] Seq=1 Ack=2 Win=290 Len=0 SLE=1 SRE=2"
"382","57.128047","2404:97c0:223:4181:d8ac:cbb4:17b:ef4b","2404:6800:4003:c02::84","TCP","75","[TCP Keep-Alive] 63253  >  443 [ACK] Seq=1 Ack=1 Win=511 Len=1"
"383","57.232343","2404:6800:4003:c02::84","2404:97c0:223:4181:d8ac:cbb4:17b:ef4b","TCP","86","[TCP Keep-Alive ACK] 443  >  63253 [ACK] Seq=1 Ack=2 Win=279 Len=0 SLE=1 SRE=2"
"384","58.072571","192.168.1.14","192.168.1.12","TCP","164","62706  >  8009 [PSH, ACK] Seq=1321 Ack=1325 Win=510 Len=110"
"385","58.076931","192.168.1.12","192.168.1.14","TCP","164","8009  >  62706 [PSH, ACK] Seq=1325 Ack=1431 Win=1506 Len=110"
"386","58.118786","192.168.1.14","192.168.1.12","TCP","54","62706  >  8009 [ACK] Seq=1431 Ack=1435 Win=509 Len=0"
"387","59.469353","192.168.1.14","192.168.1.12","TCP","164","62671  >  8009 [PSH, ACK] Seq=1211 Ack=1211 Win=511 Len=110"
"388","59.471729","192.168.1.12","192.168.1.14","TCP","164","8009  >  62671 [PSH, ACK] Seq=1211 Ack=1321 Win=1506 Len=110"
"389","59.516344","192.168.1.14","192.168.1.12","TCP","54","62671  >  8009 [ACK] Seq=1321 Ack=1321 Win=510 Len=0"
"392","60.375216","2620:1ec:8fa::254","2404:97c0:223:4181:d8ac:cbb4:17b:ef4b","TCP","74","443  >  63280 [RST, ACK] Seq=1 Ack=1 Win=0 Len=0"
"393","61.116605","2404:97c0:223:4181:d8ac:cbb4:17b:ef4b","2600:1901:1:566::","TLSv1.2","117","Application Data"
"394","61.128795","2600:1901:1:566::","2404:97c0:223:4181:d8ac:cbb4:17b:ef4b","TCP","74","443  >  62702 [ACK] Seq=81 Ack=130 Win=290 Len=0"
"395","61.431371","2600:1901:1:566::","2404:97c0:223:4181:d8ac:cbb4:17b:ef4b","TLSv1.2","114","Application Data"
"396","61.478790","2404:97c0:223:4181:d8ac:cbb4:17b:ef4b","2600:1901:1:566::","TCP","74","62702  >  443 [ACK] Seq=130 Ack=121 Win=513 Len=0"
"399","63.083451","192.168.1.14","192.168.1.12","TCP","164","62706  >  8009 [PSH, ACK] Seq=1431 Ack=1435 Win=509 Len=110"
"400","63.087778","192.168.1.12","192.168.1.14","TCP","164","8009  >  62706 [PSH, ACK] Seq=1435 Ack=1541 Win=1506 Len=110"
"401","63.130172","192.168.1.14","192.168.1.12","TCP","54","62706  >  8009 [ACK] Seq=1541 Ack=1545 Win=509 Len=0"
"402","63.633837","204.79.197.222","192.168.1.14","TCP","54","443  >  63283 [RST, ACK] Seq=1 Ack=1 Win=0 Len=0"
"403","63.951433","2603:1063:27:1::254","2404:97c0:223:4181:d8ac:cbb4:17b:ef4b","TCP","74","443  >  63281 [RST, ACK] Seq=1 Ack=1 Win=0 Len=0"
"404","64.483343","192.168.1.14","192.168.1.12","TCP","164","62671  >  8009 [PSH, ACK] Seq=1321 Ack=1321 Win=510 Len=110"
"405","64.485689","192.168.1.12","192.168.1.14","TCP","164","8009  >  62671 [PSH, ACK] Seq=1321 Ack=1431 Win=1506 Len=110"
"406","64.530761","192.168.1.14","192.168.1.12","TCP","54","62671  >  8009 [ACK] Seq=1431 Ack=1431 Win=510 Len=0"
"407","64.661644","2600:1417:6000::1730:ad11","2404:97c0:223:4181:d8ac:cbb4:17b:ef4b","TLSv1.2","98","Application Data"
"408","64.661767","2404:97c0:223:4181:d8ac:cbb4:17b:ef4b","2600:1417:6000::1730:ad11","TCP","74","63265  >  443 [ACK] Seq=1 Ack=25 Win=1021 Len=0"
"409","64.661894","2600:1417:6000::1730:ad11","2404:97c0:223:4181:d8ac:cbb4:17b:ef4b","TCP","74","443  >  63265 [FIN, ACK] Seq=25 Ack=1 Win=1960 Len=0"
"410","64.661922","2404:97c0:223:4181:d8ac:cbb4:17b:ef4b","2600:1417:6000::1730:ad11","TCP","74","63265  >  443 [ACK] Seq=1 Ack=26 Win=1021 Len=0"
"411","68.098354","192.168.1.14","192.168.1.12","TCP","164","62706  >  8009 [PSH, ACK] Seq=1541 Ack=1545 Win=509 Len=110"
"412","68.100980","192.168.1.12","192.168.1.14","TCP","164","8009  >  62706 [PSH, ACK] Seq=1545 Ack=1651 Win=1506 Len=110"
"413","68.145194","192.168.1.14","192.168.1.12","TCP","54","62706  >  8009 [ACK] Seq=1651 Ack=1655 Win=508 Len=0"
"414","68.364820","2404:97c0:223:4181:d8ac:cbb4:17b:ef4b","2600:1901:1:4be::","TCP","75","[TCP Keep-Alive] 63072  >  443 [ACK] Seq=1 Ack=1 Win=512 Len=1"
"415","68.376475","2600:1901:1:4be::","2404:97c0:223:4181:d8ac:cbb4:17b:ef4b","TCP","86","[TCP Keep-Alive ACK] 443  >  63072 [ACK] Seq=1 Ack=2 Win=279 Len=0 SLE=1 SRE=2"
"419","69.487449","192.168.1.14","192.168.1.12","TCP","164","62671  >  8009 [PSH, ACK] Seq=1431 Ack=1431 Win=510 Len=110"
"420","69.489423","192.168.1.12","192.168.1.14","TCP","164","8009  >  62671 [PSH, ACK] Seq=1431 Ack=1541 Win=1506 Len=110"
"421","69.534278","192.168.1.14","192.168.1.12","TCP","54","62671  >  8009 [ACK] Seq=1541 Ack=1541 Win=509 Len=0"
"422","73.116173","192.168.1.14","192.168.1.12","TCP","164","62706  >  8009 [PSH, ACK] Seq=1651 Ack=1655 Win=508 Len=110"
"423","73.119906","192.168.1.12","192.168.1.14","TCP","164","8009  >  62706 [PSH, ACK] Seq=1655 Ack=1761 Win=1506 Len=110"
"426","73.148056","192.168.1.14","3.165.102.101","TCP","55","[TCP Keep-Alive] 62870  >  443 [ACK] Seq=1 Ack=1 Win=512 Len=1"
"427","73.163548","192.168.1.14","192.168.1.12","TCP","54","62706  >  8009 [ACK] Seq=1761 Ack=1765 Win=508 Len=0"
"428","73.171816","3.165.102.101","192.168.1.14","TCP","66","[TCP Keep-Alive ACK] 443  >  62870 [ACK] Seq=1 Ack=2 Win=151 Len=0 SLE=1 SRE=2"
"431","73.726821","192.168.1.14","35.186.224.44","TLSv1.2","82","Application Data"
"432","73.739632","35.186.224.44","192.168.1.14","TCP","54","443  >  62694 [ACK] Seq=49 Ack=85 Win=272 Len=0"
"433","74.043016","35.186.224.44","192.168.1.14","TLSv1.2","78","Application Data"
"434","74.086246","192.168.1.14","35.186.224.44","TCP","54","62694  >  443 [ACK] Seq=85 Ack=73 Win=508 Len=0"
"435","74.494431","192.168.1.14","192.168.1.12","TCP","164","62671  >  8009 [PSH, ACK] Seq=1541 Ack=1541 Win=509 Len=110"
"436","74.497646","192.168.1.12","192.168.1.14","TCP","164","8009  >  62671 [PSH, ACK] Seq=1541 Ack=1651 Win=1506 Len=110"
"437","74.540840","192.168.1.14","192.168.1.12","TCP","54","62671  >  8009 [ACK] Seq=1651 Ack=1651 Win=509 Len=0"
"442","78.124117","192.168.1.14","192.168.1.12","TCP","164","62706  >  8009 [PSH, ACK] Seq=1761 Ack=1765 Win=508 Len=110"
"443","78.126057","192.168.1.12","192.168.1.14","TCP","164","8009  >  62706 [PSH, ACK] Seq=1765 Ack=1871 Win=1506 Len=110"
"444","78.170825","192.168.1.14","192.168.1.12","TCP","54","62706  >  8009 [ACK] Seq=1871 Ack=1875 Win=508 Len=0"
"445","79.512910","192.168.1.14","192.168.1.12","TCP","164","62671  >  8009 [PSH, ACK] Seq=1651 Ack=1651 Win=509 Len=110"
"446","79.517842","192.168.1.12","192.168.1.14","TCP","164","8009  >  62671 [PSH, ACK] Seq=1651 Ack=1761 Win=1506 Len=110"
"447","79.560191","192.168.1.14","192.168.1.12","TCP","54","62671  >  8009 [ACK] Seq=1761 Ack=1761 Win=508 Len=0"
"463","83.088978","2404:97c0:223:4181:d8ac:cbb4:17b:ef4b","2404:6800:4003:c11::61","TCP","75","[TCP Keep-Alive] 63218  >  443 [ACK] Seq=1 Ack=1 Win=510 Len=1"
"464","83.136331","192.168.1.14","192.168.1.12","TCP","164","62706  >  8009 [PSH, ACK] Seq=1871 Ack=1875 Win=508 Len=110"
"465","83.139130","192.168.1.12","192.168.1.14","TCP","164","8009  >  62706 [PSH, ACK] Seq=1875 Ack=1981 Win=1506 Len=110"
"466","83.183218","192.168.1.14","192.168.1.12","TCP","54","62706  >  8009 [ACK] Seq=1981 Ack=1985 Win=507 Len=0"
"467","83.194060","2404:6800:4003:c11::61","2404:97c0:223:4181:d8ac:cbb4:17b:ef4b","TCP","86","[TCP Keep-Alive ACK] 443  >  63218 [ACK] Seq=1 Ack=2 Win=290 Len=0 SLE=1 SRE=2"
"468","83.434925","2404:97c0:223:4181:d8ac:cbb4:17b:ef4b","2001:4860:4802:38::178","TCP","75","[TCP Keep-Alive] 63222  >  443 [ACK] Seq=1 Ack=1 Win=515 Len=1"
"469","83.539305","2001:4860:4802:38::178","2404:97c0:223:4181:d8ac:cbb4:17b:ef4b","TCP","86","[TCP Keep-Alive ACK] 443  >  63222 [ACK] Seq=1 Ack=2 Win=279 Len=0 SLE=1 SRE=2"
"470","83.654260","2404:97c0:223:4181:d8ac:cbb4:17b:ef4b","2404:6800:4003:c00::9c","TCP","75","[TCP Keep-Alive] 63223  >  443 [ACK] Seq=1 Ack=1 Win=511 Len=1"
